{
  "version": 1,
  "course_id": "big-data-analysis-engineer-practical",
  "title": "빅데이터분석기사 실기",
  "certification": "빅데이터분석기사",
  "mode": "practical",
  "authority": "한국데이터산업진흥원(K-DATA)",
  "verified_at": "2026-08-26",
  "sources": [
    {
      "id": "dataq-bae-scope",
      "title": "빅데이터분석기사(BAE : Bigdata Analysis Engineer) — 시험주요내용",
      "authority": "한국데이터산업진흥원(K-DATA)",
      "url": "https://www.dataq.or.kr/www/sub/a_07.do",
      "effective_from": null,
      "effective_to": null,
      "retrieved_at": "2026-08-26"
    },
    {
      "id": "dataq-2026-schedule",
      "title": "2026년도 데이터자격검정 시험일정",
      "authority": "한국데이터산업진흥원(K-DATA)",
      "url": "https://www.dataq.or.kr/www/accept/schedule.do",
      "effective_from": null,
      "effective_to": null,
      "retrieved_at": "2026-08-26"
    },
    {
      "id": "dataq-practical-trial",
      "title": "빅데이터분석기사 실기 체험환경",
      "authority": "한국데이터산업진흥원(K-DATA)",
      "url": "https://goor.me/EvH8T",
      "effective_from": null,
      "effective_to": null,
      "retrieved_at": "2026-08-26"
    },
    {
      "id": "dataq-practical-guide",
      "title": "빅데이터분석기사 실기 체험 환경 가이드",
      "authority": "한국데이터산업진흥원(K-DATA)",
      "url": "https://kr.object.gov-ncloudstorage.com/dataq/dataq-10th/%5BK-DATA%5D%20%EB%B9%85%EB%8D%B0%EC%9D%B4%ED%84%B0%EB%B6%84%EC%84%9D%EA%B8%B0%EC%82%AC%20%EC%8B%A4%EA%B8%B0%20%EC%B2%B4%ED%97%98%ED%99%98%EA%B2%BD%20%EA%B0%80%EC%9D%B4%EB%93%9C_250605.pdf",
      "effective_from": null,
      "effective_to": null,
      "retrieved_at": "2026-08-26"
    }
  ],
  "sections": [
    {
      "id": "1",
      "title": "데이터 수집 작업",
      "official_name": "데이터 수집 작업",
      "units": [
        {
          "id": "1-1",
          "title": "데이터 수집하기",
          "official_name": "데이터 수집하기",
          "lessons": [
            {
              "id": "1-1-1",
              "title": "다양한 형태의 데이터 읽기",
              "official_name": "정형·반정형·비정형 데이터 읽기",
              "official_basis": [
                "빅데이터 분석 실무 > 데이터 수집 작업 > 데이터 수집하기"
              ],
              "sublessons": [
                {
                  "id": "1-1-1-1",
                  "title": "정형·반정형·비정형 데이터 읽기",
                  "slug": "read-structured-semi-unstructured-data",
                  "topics": [
                    "정형 데이터 읽기",
                    "반정형 데이터 읽기",
                    "비정형 데이터 읽기"
                  ],
                  "lesson_type": "coding",
                  "supplemental": false,
                  "source_refs": [
                    "dataq-bae-scope"
                  ],
                  "official_basis": [
                    "빅데이터 분석 실무 > 데이터 수집 작업 > 데이터 수집하기 > 정형, 반정형, 비정형 등 다양한 형태의 데이터를 읽을 수 있다."
                  ]
                }
              ]
            },
            {
              "id": "1-1-2",
              "title": "공개 데이터 수집",
              "official_name": "공개 데이터 수집",
              "official_basis": [
                "빅데이터 분석 실무 > 데이터 수집 작업 > 데이터 수집하기"
              ],
              "sublessons": [
                {
                  "id": "1-1-2-1",
                  "title": "공개 데이터 확보와 적재",
                  "slug": "collect-public-data",
                  "topics": [
                    "공개 데이터 접근",
                    "데이터 수집",
                    "수집 결과 확인"
                  ],
                  "lesson_type": "data-handling",
                  "supplemental": false,
                  "source_refs": [
                    "dataq-bae-scope"
                  ],
                  "official_basis": [
                    "빅데이터 분석 실무 > 데이터 수집 작업 > 데이터 수집하기 > 필요시 공개 데이터를 수집할 수 있다."
                  ]
                }
              ]
            }
          ]
        }
      ]
    },
    {
      "id": "2",
      "title": "데이터 전처리 작업",
      "official_name": "데이터 전처리 작업",
      "units": [
        {
          "id": "2-1",
          "title": "데이터 정제하기",
          "official_name": "데이터 정제하기",
          "lessons": [
            {
              "id": "2-1-1",
              "title": "정제 대상 파악",
              "official_name": "결측값·이상값 파악",
              "official_basis": [
                "빅데이터 분석 실무 > 데이터 전처리 작업 > 데이터 정제하기"
              ],
              "sublessons": [
                {
                  "id": "2-1-1-1",
                  "title": "결측값과 이상값 진단",
                  "slug": "diagnose-missing-values-and-outliers",
                  "topics": [
                    "결측값 탐색",
                    "이상값 탐색",
                    "정제 필요성 판단"
                  ],
                  "lesson_type": "coding",
                  "supplemental": false,
                  "source_refs": [
                    "dataq-bae-scope"
                  ],
                  "official_basis": [
                    "빅데이터 분석 실무 > 데이터 전처리 작업 > 데이터 정제하기 > 정제가 필요한 결측값, 이상값 등이 무엇인지 파악할 수 있다."
                  ]
                }
              ]
            },
            {
              "id": "2-1-2",
              "title": "처리 기준 수립과 적용",
              "official_name": "결측값·이상값 처리",
              "official_basis": [
                "빅데이터 분석 실무 > 데이터 전처리 작업 > 데이터 정제하기"
              ],
              "sublessons": [
                {
                  "id": "2-1-2-1",
                  "title": "결측값과 이상값 처리",
                  "slug": "treat-missing-values-and-outliers",
                  "topics": [
                    "처리 기준 설정",
                    "제거 적용",
                    "값 대체 적용"
                  ],
                  "lesson_type": "coding",
                  "supplemental": false,
                  "source_refs": [
                    "dataq-bae-scope"
                  ],
                  "official_basis": [
                    "빅데이터 분석 실무 > 데이터 전처리 작업 > 데이터 정제하기 > 결측값와 이상값에 대한 처리 기준을 정하고 제거 또는 임의의 값으로 대체할 수 있다."
                  ]
                }
              ]
            }
          ]
        },
        {
          "id": "2-2",
          "title": "데이터 변환하기",
          "official_name": "데이터 변환하기",
          "lessons": [
            {
              "id": "2-2-1",
              "title": "데이터 유형 변환",
              "official_name": "데이터 유형 변환",
              "official_basis": [
                "빅데이터 분석 실무 > 데이터 전처리 작업 > 데이터 변환하기"
              ],
              "sublessons": [
                {
                  "id": "2-2-1-1",
                  "title": "자료형과 표현 변환",
                  "slug": "convert-data-types",
                  "topics": [
                    "현재 유형 확인",
                    "목표 유형 변환",
                    "변환 결과 검증"
                  ],
                  "lesson_type": "coding",
                  "supplemental": false,
                  "source_refs": [
                    "dataq-bae-scope"
                  ],
                  "official_basis": [
                    "빅데이터 분석 실무 > 데이터 전처리 작업 > 데이터 변환하기 > 데이터의 유형을 원하는 형태로 변환할 수 있다."
                  ]
                }
              ]
            },
            {
              "id": "2-2-2",
              "title": "데이터 범위 변환",
              "official_name": "표준화·정규화",
              "official_basis": [
                "빅데이터 분석 실무 > 데이터 전처리 작업 > 데이터 변환하기"
              ],
              "sublessons": [
                {
                  "id": "2-2-2-1",
                  "title": "표준화와 정규화",
                  "slug": "standardize-and-normalize-data",
                  "topics": [
                    "표준화 적용",
                    "정규화 적용",
                    "변환 결과 비교"
                  ],
                  "lesson_type": "coding",
                  "supplemental": false,
                  "source_refs": [
                    "dataq-bae-scope"
                  ],
                  "official_basis": [
                    "빅데이터 분석 실무 > 데이터 전처리 작업 > 데이터 변환하기 > 데이터의 범위를 표준화 또는 정규화를 통해 일치시킬 수 있다."
                  ]
                }
              ]
            },
            {
              "id": "2-2-3",
              "title": "변수 생성과 선택",
              "official_name": "파생변수 생성·변수 선택",
              "official_basis": [
                "빅데이터 분석 실무 > 데이터 전처리 작업 > 데이터 변환하기"
              ],
              "sublessons": [
                {
                  "id": "2-2-3-1",
                  "title": "파생변수 생성",
                  "slug": "derive-features",
                  "topics": [
                    "기존 변수 조합",
                    "파생변수 구현",
                    "생성 결과 확인"
                  ],
                  "lesson_type": "coding",
                  "supplemental": false,
                  "source_refs": [
                    "dataq-bae-scope"
                  ],
                  "official_basis": [
                    "빅데이터 분석 실무 > 데이터 전처리 작업 > 데이터 변환하기 > 기존 변수를 이용하여 의미 있는 새로운 변수를 생성하거나 변수를 선택할 수 있다."
                  ]
                },
                {
                  "id": "2-2-3-2",
                  "title": "변수 선택",
                  "slug": "select-features",
                  "topics": [
                    "후보 변수 파악",
                    "선택 기준 적용",
                    "선택 결과 확인"
                  ],
                  "lesson_type": "coding",
                  "supplemental": false,
                  "source_refs": [
                    "dataq-bae-scope"
                  ],
                  "official_basis": [
                    "빅데이터 분석 실무 > 데이터 전처리 작업 > 데이터 변환하기 > 기존 변수를 이용하여 의미 있는 새로운 변수를 생성하거나 변수를 선택할 수 있다."
                  ]
                }
              ]
            }
          ]
        }
      ]
    },
    {
      "id": "3",
      "title": "데이터 모형 구축 작업",
      "official_name": "데이터 모형 구축 작업",
      "units": [
        {
          "id": "3-1",
          "title": "분석모형 선택하기",
          "official_name": "분석모형 선택하기",
          "lessons": [
            {
              "id": "3-1-1",
              "title": "분석모형 이해",
              "official_name": "다양한 분석모형 이해",
              "official_basis": [
                "빅데이터 분석 실무 > 데이터 모형 구축 작업 > 분석모형 선택하기"
              ],
              "sublessons": [
                {